cik,name,report_year,docID,sentenceID,section_name,section_item,section_ID,form,sentence_index,sentence,SIC,reportDate,temporal_bin,sample_created_at,last_modified_date,sample_version,source_file_path,load_method
0001652044,Alphabet Inc.,2016,0001652044_10-K_2016,0001652044_10-K_2016_section_1_0,Business,item_1,0,10-K,0,"Item 1 BUSINESS Overview As our founders Larry and Sergey wrote in the original founders' letter, ""Google is not a conventional company.",7370,2017-02-03,bin_2016_2020,2025-10-25 00:42:34.754116,2025-10-25 00:42:34.754116,v2.1_combined_extraction,D:\JoelDesktop folds_24\NEU FALL2025\MLops IE7374 Project\MLOps_Final\datasets\EXTRACTED_FILINGS\10-K\1652044_10K_2016_0001652044-17-000008.json,extract_and_convert
0001652044,Alphabet Inc.,2016,0001652044_10-K_2016,0001652044_10-K_2016_section_1_1,Business,item_1,0,10-K,1,"We do not intend to become one.""",7370,2017-02-03,bin_2016_2020,2025-10-25 00:42:34.754116,2025-10-25 00:42:34.754116,v2.1_combined_extraction,D:\JoelDesktop folds_24\NEU FALL2025\MLops IE7374 Project\MLOps_Final\datasets\EXTRACTED_FILINGS\10-K\1652044_10K_2016_0001652044-17-000008.json,extract_and_convert
0001652044,Alphabet Inc.,2016,0001652044_10-K_2016,0001652044_10-K_2016_section_1_2,Business,item_1,0,10-K,2,That unconventional spirit has been a driving force throughout our history -- inspiring us to do things like rethink the mobile device ecosystem with Android and map the world with Google Maps.,7370,2017-02-03,bin_2016_2020,2025-10-25 00:42:34.754116,2025-10-25 00:42:34.754116,v2.1_combined_extraction,D:\JoelDesktop folds_24\NEU FALL2025\MLops IE7374 Project\MLOps_Final\datasets\EXTRACTED_FILINGS\10-K\1652044_10K_2016_0001652044-17-000008.json,extract_and_convert
0001652044,Alphabet Inc.,2016,0001652044_10-K_2016,0001652044_10-K_2016_section_1_3,Business,item_1,0,10-K,3,"As part of that, our founders also explained that you could expect us to make ""smaller bets in areas that might seem very speculative or even strange when compared to our current businesses.""",7370,2017-02-03,bin_2016_2020,2025-10-25 00:42:34.754116,2025-10-25 00:42:34.754116,v2.1_combined_extraction,D:\JoelDesktop folds_24\NEU FALL2025\MLops IE7374 Project\MLOps_Final\datasets\EXTRACTED_FILINGS\10-K\1652044_10K_2016_0001652044-17-000008.json,extract_and_convert
0001652044,Alphabet Inc.,2016,0001652044_10-K_2016,0001652044_10-K_2016_section_1_4,Business,item_1,0,10-K,4,"From the start, the company has always strived to do more, and to do important and meaningful things with the resources we have.",7370,2017-02-03,bin_2016_2020,2025-10-25 00:42:34.754116,2025-10-25 00:42:34.754116,v2.1_combined_extraction,D:\JoelDesktop folds_24\NEU FALL2025\MLops IE7374 Project\MLOps_Final\datasets\EXTRACTED_FILINGS\10-K\1652044_10K_2016_0001652044-17-000008.json,extract_and_convert
0001652044,Alphabet Inc.,2016,0001652044_10-K_2016,0001652044_10-K_2016_section_1_5,Business,item_1,0,10-K,5,"Alphabet is a collection of businesses -- the largest of which, of course, is Google.",7370,2017-02-03,bin_2016_2020,2025-10-25 00:42:34.754116,2025-10-25 00:42:34.754116,v2.1_combined_extraction,D:\JoelDesktop folds_24\NEU FALL2025\MLops IE7374 Project\MLOps_Final\datasets\EXTRACTED_FILINGS\10-K\1652044_10K_2016_0001652044-17-000008.json,extract_and_convert
0001652044,Alphabet Inc.,2016,0001652044_10-K_2016,0001652044_10-K_2016_section_1_6,Business,item_1,0,10-K,6,"It also includes businesses that are generally pretty far afield of our main Internet products such as Access, Calico, CapitalG, GV, Nest, Verily, Waymo, and X.",7370,2017-02-03,bin_2016_2020,2025-10-25 00:42:34.754116,2025-10-25 00:42:34.754116,v2.1_combined_extraction,D:\JoelDesktop folds_24\NEU FALL2025\MLops IE7374 Project\MLOps_Final\datasets\EXTRACTED_FILINGS\10-K\1652044_10K_2016_0001652044-17-000008.json,extract_and_convert
0001652044,Alphabet Inc.,2016,0001652044_10-K_2016,0001652044_10-K_2016_section_1_7,Business,item_1,0,10-K,7,We report all non-Google businesses collectively as Other Bets.,7370,2017-02-03,bin_2016_2020,2025-10-25 00:42:34.754116,2025-10-25 00:42:34.754116,v2.1_combined_extraction,D:\JoelDesktop folds_24\NEU FALL2025\MLops IE7374 Project\MLOps_Final\datasets\EXTRACTED_FILINGS\10-K\1652044_10K_2016_0001652044-17-000008.json,extract_and_convert
0001652044,Alphabet Inc.,2016,0001652044_10-K_2016,0001652044_10-K_2016_section_1_8,Business,item_1,0,10-K,8,Our Alphabet structure is about helping each of our businesses prosper through strong leaders and independence.,7370,2017-02-03,bin_2016_2020,2025-10-25 00:42:34.754116,2025-10-25 00:42:34.754116,v2.1_combined_extraction,D:\JoelDesktop folds_24\NEU FALL2025\MLops IE7374 Project\MLOps_Final\datasets\EXTRACTED_FILINGS\10-K\1652044_10K_2016_0001652044-17-000008.json,extract_and_convert
0001652044,Alphabet Inc.,2016,0001652044_10-K_2016,0001652044_10-K_2016_section_1_9,Business,item_1,0,10-K,9,"Access and technology for everyone The Internet is one of the world's most powerful equalizers, and we see it as our job to make it available to as many people as possible.",7370,2017-02-03,bin_2016_2020,2025-10-25 00:42:34.754116,2025-10-25 00:42:34.754116,v2.1_combined_extraction,D:\JoelDesktop folds_24\NEU FALL2025\MLops IE7374 Project\MLOps_Final\datasets\EXTRACTED_FILINGS\10-K\1652044_10K_2016_0001652044-17-000008.json,extract_and_convert
0001652044,Alphabet Inc.,2016,0001652044_10-K_2016,0001652044_10-K_2016_section_1_10,Business,item_1,0,10-K,10,"At its core, Google has always been an information company.",7370,2017-02-03,bin_2016_2020,2025-10-25 00:42:34.754116,2025-10-25 00:42:34.754116,v2.1_combined_extraction,D:\JoelDesktop folds_24\NEU FALL2025\MLops IE7374 Project\MLOps_Final\datasets\EXTRACTED_FILINGS\10-K\1652044_10K_2016_0001652044-17-000008.json,extract_and_convert
0001652044,Alphabet Inc.,2016,0001652044_10-K_2016,0001652044_10-K_2016_section_1_11,Business,item_1,0,10-K,11,"We believe that technology is a democratizing force, empowering people through information.",7370,2017-02-03,bin_2016_2020,2025-10-25 00:42:34.754116,2025-10-25 00:42:34.754116,v2.1_combined_extraction,D:\JoelDesktop folds_24\NEU FALL2025\MLops IE7374 Project\MLOps_Final\datasets\EXTRACTED_FILINGS\10-K\1652044_10K_2016_0001652044-17-000008.json,extract_and_convert
0001652044,Alphabet Inc.,2016,0001652044_10-K_2016,0001652044_10-K_2016_section_1_12,Business,item_1,0,10-K,12,"We are helping people get online by tailoring hardware and software experiences that suit the needs of emerging markets, primarily through Android and Chrome.",7370,2017-02-03,bin_2016_2020,2025-10-25 00:42:34.754116,2025-10-25 00:42:34.754116,v2.1_combined_extraction,D:\JoelDesktop folds_24\NEU FALL2025\MLops IE7374 Project\MLOps_Final\datasets\EXTRACTED_FILINGS\10-K\1652044_10K_2016_0001652044-17-000008.json,extract_and_convert
0001652044,Alphabet Inc.,2016,0001652044_10-K_2016,0001652044_10-K_2016_section_1_13,Business,item_1,0,10-K,13,"We're also making sure our core Google products are fast and useful, especially for users in areas where speed and connectivity are central concerns.",7370,2017-02-03,bin_2016_2020,2025-10-25 00:42:34.754116,2025-10-25 00:42:34.754116,v2.1_combined_extraction,D:\JoelDesktop folds_24\NEU FALL2025\MLops IE7374 Project\MLOps_Final\datasets\EXTRACTED_FILINGS\10-K\1652044_10K_2016_0001652044-17-000008.json,extract_and_convert
0001652044,Alphabet Inc.,2016,0001652044_10-K_2016,0001652044_10-K_2016_section_1_14,Business,item_1,0,10-K,14,Other Alphabet companies are also pursuing initiatives with similar goals.,7370,2017-02-03,bin_2016_2020,2025-10-25 00:42:34.754116,2025-10-25 00:42:34.754116,v2.1_combined_extraction,D:\JoelDesktop folds_24\NEU FALL2025\MLops IE7374 Project\MLOps_Final\datasets\EXTRACTED_FILINGS\10-K\1652044_10K_2016_0001652044-17-000008.json,extract_and_convert
0001652044,Alphabet Inc.,2016,0001652044_10-K_2016,0001652044_10-K_2016_section_1_15,Business,item_1,0,10-K,15,"Moonshots Many companies get comfortable doing what they have always done, making only incremental changes.",7370,2017-02-03,bin_2016_2020,2025-10-25 00:42:34.754116,2025-10-25 00:42:34.754116,v2.1_combined_extraction,D:\JoelDesktop folds_24\NEU FALL2025\MLops IE7374 Project\MLOps_Final\datasets\EXTRACTED_FILINGS\10-K\1652044_10K_2016_0001652044-17-000008.json,extract_and_convert
0001652044,Alphabet Inc.,2016,0001652044_10-K_2016,0001652044_10-K_2016_section_1_16,Business,item_1,0,10-K,16,"This incrementalism leads to irrelevance over time, especially in technology, where change tends to be revolutionary, not evolutionary.",7370,2017-02-03,bin_2016_2020,2025-10-25 00:42:34.754116,2025-10-25 00:42:34.754116,v2.1_combined_extraction,D:\JoelDesktop folds_24\NEU FALL2025\MLops IE7374 Project\MLOps_Final\datasets\EXTRACTED_FILINGS\10-K\1652044_10K_2016_0001652044-17-000008.json,extract_and_convert
0001652044,Alphabet Inc.,2016,0001652044_10-K_2016,0001652044_10-K_2016_section_1_17,Business,item_1,0,10-K,17,"People thought we were crazy when we acquired YouTube and Android and when we launched Chrome, but those efforts have matured into major platforms for digital video and mobile devices and a safer, popular browser.",7370,2017-02-03,bin_2016_2020,2025-10-25 00:42:34.754116,2025-10-25 00:42:34.754116,v2.1_combined_extraction,D:\JoelDesktop folds_24\NEU FALL2025\MLops IE7374 Project\MLOps_Final\datasets\EXTRACTED_FILINGS\10-K\1652044_10K_2016_0001652044-17-000008.json,extract_and_convert
0001652044,Alphabet Inc.,2016,0001652044_10-K_2016,0001652044_10-K_2016_section_1_18,Business,item_1,0,10-K,18,We continue to look toward the future and continue to invest for the long-term.,7370,2017-02-03,bin_2016_2020,2025-10-25 00:42:34.754116,2025-10-25 00:42:34.754116,v2.1_combined_extraction,D:\JoelDesktop folds_24\NEU FALL2025\MLops IE7374 Project\MLOps_Final\datasets\EXTRACTED_FILINGS\10-K\1652044_10K_2016_0001652044-17-000008.json,extract_and_convert
0001652044,Alphabet Inc.,2016,0001652044_10-K_2016,0001652044_10-K_2016_section_1_19,Business,item_1,0,10-K,19,"We won't become complacent, relying solely on small tweaks.",7370,2017-02-03,bin_2016_2020,2025-10-25 00:42:34.754116,2025-10-25 00:42:34.754116,v2.1_combined_extraction,D:\JoelDesktop folds_24\NEU FALL2025\MLops IE7374 Project\MLOps_Final\datasets\EXTRACTED_FILINGS\10-K\1652044_10K_2016_0001652044-17-000008.json,extract_and_convert
0001652044,Alphabet Inc.,2016,0001652044_10-K_2016,0001652044_10-K_2016_section_1_20,Business,item_1,0,10-K,20,"As we said in the original founders' letter, we will not shy away from high-risk, high-reward projects that we believe in because they are the key to our long-term success.",7370,2017-02-03,bin_2016_2020,2025-10-25 00:42:34.754116,2025-10-25 00:42:34.754116,v2.1_combined_extraction,D:\JoelDesktop folds_24\NEU FALL2025\MLops IE7374 Project\MLOps_Final\datasets\EXTRACTED_FILINGS\10-K\1652044_10K_2016_0001652044-17-000008.json,extract_and_convert
0001652044,Alphabet Inc.,2016,0001652044_10-K_2016,0001652044_10-K_2016_section_1_21,Business,item_1,0,10-K,21,"The power of machine learning Across the company, machine learning and artificial intelligence (AI) are increasingly driving many of our latest innovations.",7370,2017-02-03,bin_2016_2020,2025-10-25 00:42:34.754116,2025-10-25 00:42:34.754116,v2.1_combined_extraction,D:\JoelDesktop folds_24\NEU FALL2025\MLops IE7374 Project\MLOps_Final\datasets\EXTRACTED_FILINGS\10-K\1652044_10K_2016_0001652044-17-000008.json,extract_and_convert
0001652044,Alphabet Inc.,2016,0001652044_10-K_2016,0001652044_10-K_2016_section_1_22,Business,item_1,0,10-K,22,"Within Google, our investments in machine learning over a decade are what have enabled us to build Google products that get better over time, making them smarter and more useful -- it's what allows you to use your voice to search for information, to translate the web from one language to another, to see better YouTube recommendations, and to search for people and events that are important to you in Google Photos.",7370,2017-02-03,bin_2016_2020,2025-10-25 00:42:34.754116,2025-10-25 00:42:34.754116,v2.1_combined_extraction,D:\JoelDesktop folds_24\NEU FALL2025\MLops IE7374 Project\MLOps_Final\datasets\EXTRACTED_FILINGS\10-K\1652044_10K_2016_0001652044-17-000008.json,extract_and_convert
0001652044,Alphabet Inc.,2016,0001652044_10-K_2016,0001652044_10-K_2016_section_1_23,Business,item_1,0,10-K,23,"Machine learning is also showing great promise in helping us tackle big issues, like dramatically improving the energy efficiency of our data centers.",7370,2017-02-03,bin_2016_2020,2025-10-25 00:42:34.754116,2025-10-25 00:42:34.754116,v2.1_combined_extraction,D:\JoelDesktop folds_24\NEU FALL2025\MLops IE7374 Project\MLOps_Final\datasets\EXTRACTED_FILINGS\10-K\1652044_10K_2016_0001652044-17-000008.json,extract_and_convert
0001652044,Alphabet Inc.,2016,0001652044_10-K_2016,0001652044_10-K_2016_section_1_24,Business,item_1,0,10-K,24,"Across Other Bets, machine learning helps self-driving cars better detect and respond to others on the road, and can also aid clinicians in detecting diabetic retinopathy.",7370,2017-02-03,bin_2016_2020,2025-10-25 00:42:34.754116,2025-10-25 00:42:34.754116,v2.1_combined_extraction,D:\JoelDesktop folds_24\NEU FALL2025\MLops IE7374 Project\MLOps_Final\datasets\EXTRACTED_FILINGS\10-K\1652044_10K_2016_0001652044-17-000008.json,extract_and_convert
0001652044,Alphabet Inc.,2016,0001652044_10-K_2016,0001652044_10-K_2016_section_1_25,Business,item_1,0,10-K,25,Google Serving our users We have always been a company committed to making big bets that have the potential to improve the lives of millions of people.,7370,2017-02-03,bin_2016_2020,2025-10-25 00:42:34.754116,2025-10-25 00:42:34.754116,v2.1_combined_extraction,D:\JoelDesktop folds_24\NEU FALL2025\MLops IE7374 Project\MLOps_Final\datasets\EXTRACTED_FILINGS\10-K\1652044_10K_2016_0001652044-17-000008.json,extract_and_convert
0001652044,Alphabet Inc.,2016,0001652044_10-K_2016,0001652044_10-K_2016_section_1_26,Business,item_1,0,10-K,26,"As the majority of Alphabet's big bets continue to reside within Google, an important benefit of the shift to Alphabet has been the tremendous focus that we're able to have on Google's many extraordinary opportunities.",7370,2017-02-03,bin_2016_2020,2025-10-25 00:42:34.754116,2025-10-25 00:42:34.754116,v2.1_combined_extraction,D:\JoelDesktop folds_24\NEU FALL2025\MLops IE7374 Project\MLOps_Final\datasets\EXTRACTED_FILINGS\10-K\1652044_10K_2016_0001652044-17-000008.json,extract_and_convert
0001652044,Alphabet Inc.,2016,0001652044_10-K_2016,0001652044_10-K_2016_section_1_27,Business,item_1,0,10-K,27,"Our innovations in areas like search and advertising have made our services widely used, and our brand one of the most recognized in the world.",7370,2017-02-03,bin_2016_2020,2025-10-25 00:42:34.754116,2025-10-25 00:42:34.754116,v2.1_combined_extraction,D:\JoelDesktop folds_24\NEU FALL2025\MLops IE7374 Project\MLOps_Final\datasets\EXTRACTED_FILINGS\10-K\1652044_10K_2016_0001652044-17-000008.json,extract_and_convert
0001652044,Alphabet Inc.,2016,0001652044_10-K_2016,0001652044_10-K_2016_section_1_28,Business,item_1,0,10-K,28,We generate revenues primarily by delivering online advertising that consumers find relevant and that advertisers find cost-effective.,7370,2017-02-03,bin_2016_2020,2025-10-25 00:42:34.754116,2025-10-25 00:42:34.754116,v2.1_combined_extraction,D:\JoelDesktop folds_24\NEU FALL2025\MLops IE7374 Project\MLOps_Final\datasets\EXTRACTED_FILINGS\10-K\1652044_10K_2016_0001652044-17-000008.json,extract_and_convert
0001652044,Alphabet Inc.,2016,0001652044_10-K_2016,0001652044_10-K_2016_section_1_29,Business,item_1,0,10-K,29,"Google's core products such as Search, Android, Maps, Chrome, YouTube, Google Play, and Gmail each have over one billion monthly active users.",7370,2017-02-03,bin_2016_2020,2025-10-25 00:42:34.754116,2025-10-25 00:42:34.754116,v2.1_combined_extraction,D:\JoelDesktop folds_24\NEU FALL2025\MLops IE7374 Project\MLOps_Final\datasets\EXTRACTED_FILINGS\10-K\1652044_10K_2016_0001652044-17-000008.json,extract_and_convert
0001652044,Alphabet Inc.,2016,0001652044_10-K_2016,0001652044_10-K_2016_section_1_30,Business,item_1,0,10-K,30,"But most important, we believe we are just beginning to scratch the surface.",7370,2017-02-03,bin_2016_2020,2025-10-25 00:42:34.754116,2025-10-25 00:42:34.754116,v2.1_combined_extraction,D:\JoelDesktop folds_24\NEU FALL2025\MLops IE7374 Project\MLOps_Final\datasets\EXTRACTED_FILINGS\10-K\1652044_10K_2016_0001652044-17-000008.json,extract_and_convert
0001652044,Alphabet Inc.,2016,0001652044_10-K_2016,0001652044_10-K_2016_section_1_31,Business,item_1,0,10-K,31,Our vision is to remain a place of incredible creativity and innovation that uses our technical expertise to tackle big problems.,7370,2017-02-03,bin_2016_2020,2025-10-25 00:42:34.754116,2025-10-25 00:42:34.754116,v2.1_combined_extraction,D:\JoelDesktop folds_24\NEU FALL2025\MLops IE7374 Project\MLOps_Final\datasets\EXTRACTED_FILINGS\10-K\1652044_10K_2016_0001652044-17-000008.json,extract_and_convert
0001652044,Alphabet Inc.,2016,0001652044_10-K_2016,0001652044_10-K_2016_section_1_32,Business,item_1,0,10-K,32,"Google's mission to organize the world's information and make it universally accessible and useful has always been our North Star, and our products have come a long way since the company was founded nearly two decades",7370,2017-02-03,bin_2016_2020,2025-10-25 00:42:34.754116,2025-10-25 00:42:34.754116,v2.1_combined_extraction,D:\JoelDesktop folds_24\NEU FALL2025\MLops IE7374 Project\MLOps_Final\datasets\EXTRACTED_FILINGS\10-K\1652044_10K_2016_0001652044-17-000008.json,extract_and_convert
0001652044,Alphabet Inc.,2016,0001652044_10-K_2016,0001652044_10-K_2016_section_1_33,Business,item_1,0,10-K,33,Alphabet Inc.,7370,2017-02-03,bin_2016_2020,2025-10-25 00:42:34.754116,2025-10-25 00:42:34.754116,v2.1_combined_extraction,D:\JoelDesktop folds_24\NEU FALL2025\MLops IE7374 Project\MLOps_Final\datasets\EXTRACTED_FILINGS\10-K\1652044_10K_2016_0001652044-17-000008.json,extract_and_convert
0001652044,Alphabet Inc.,2016,0001652044_10-K_2016,0001652044_10-K_2016_section_1_34,Business,item_1,0,10-K,34,ago.,7370,2017-02-03,bin_2016_2020,2025-10-25 00:42:34.754116,2025-10-25 00:42:34.754116,v2.1_combined_extraction,D:\JoelDesktop folds_24\NEU FALL2025\MLops IE7374 Project\MLOps_Final\datasets\EXTRACTED_FILINGS\10-K\1652044_10K_2016_0001652044-17-000008.json,extract_and_convert
0001652044,Alphabet Inc.,2016,0001652044_10-K_2016,0001652044_10-K_2016_section_1_35,Business,item_1,0,10-K,35,"We used to show just ten blue links in our results, which you had to click through to find your answers.",7370,2017-02-03,bin_2016_2020,2025-10-25 00:42:34.754116,2025-10-25 00:42:34.754116,v2.1_combined_extraction,D:\JoelDesktop folds_24\NEU FALL2025\MLops IE7374 Project\MLOps_Final\datasets\EXTRACTED_FILINGS\10-K\1652044_10K_2016_0001652044-17-000008.json,extract_and_convert
0001652044,Alphabet Inc.,2016,0001652044_10-K_2016,0001652044_10-K_2016_section_1_36,Business,item_1,0,10-K,36,"Now we are increasingly able to provide direct answers -- even if you're speaking your question using Voice Search -- which makes it quicker, easier and more natural to find what you're looking for.",7370,2017-02-03,bin_2016_2020,2025-10-25 00:42:34.754116,2025-10-25 00:42:34.754116,v2.1_combined_extraction,D:\JoelDesktop folds_24\NEU FALL2025\MLops IE7374 Project\MLOps_Final\datasets\EXTRACTED_FILINGS\10-K\1652044_10K_2016_0001652044-17-000008.json,extract_and_convert
0001652044,Alphabet Inc.,2016,0001652044_10-K_2016,0001652044_10-K_2016_section_1_37,Business,item_1,0,10-K,37,"We also introduced the Google Assistant, which allows you to type or talk with Google in a natural conversational way to help you get things done.",7370,2017-02-03,bin_2016_2020,2025-10-25 00:42:34.754116,2025-10-25 00:42:34.754116,v2.1_combined_extraction,D:\JoelDesktop folds_24\NEU FALL2025\MLops IE7374 Project\MLOps_Final\datasets\EXTRACTED_FILINGS\10-K\1652044_10K_2016_0001652044-17-000008.json,extract_and_convert
0001652044,Alphabet Inc.,2016,0001652044_10-K_2016,0001652044_10-K_2016_section_1_38,Business,item_1,0,10-K,38,"Over time, we have also added other services that let you access information quickly and easily -- like Google Maps, which helps you navigate to a store while showing you current traffic conditions, or Google Photos, which helps you store and organize all of your photos.",7370,2017-02-03,bin_2016_2020,2025-10-25 00:42:34.754116,2025-10-25 00:42:34.754116,v2.1_combined_extraction,D:\JoelDesktop folds_24\NEU FALL2025\MLops IE7374 Project\MLOps_Final\datasets\EXTRACTED_FILINGS\10-K\1652044_10K_2016_0001652044-17-000008.json,extract_and_convert
0001652044,Alphabet Inc.,2016,0001652044_10-K_2016,0001652044_10-K_2016_section_1_39,Business,item_1,0,10-K,39,"This drive to make information more accessible has led us over the years to improve the discovery and creation of digital content, on the web and through platforms like Google Play and YouTube.",7370,2017-02-03,bin_2016_2020,2025-10-25 00:42:34.754116,2025-10-25 00:42:34.754116,v2.1_combined_extraction,D:\JoelDesktop folds_24\NEU FALL2025\MLops IE7374 Project\MLOps_Final\datasets\EXTRACTED_FILINGS\10-K\1652044_10K_2016_0001652044-17-000008.json,extract_and_convert
0001652044,Alphabet Inc.,2016,0001652044_10-K_2016,0001652044_10-K_2016_section_1_40,Business,item_1,0,10-K,40,"And with the migration to mobile, people are consuming more digital content by watching more videos, playing more games, listening to more music, reading more books, and using more apps than ever before.",7370,2017-02-03,bin_2016_2020,2025-10-25 00:42:34.754116,2025-10-25 00:42:34.754116,v2.1_combined_extraction,D:\JoelDesktop folds_24\NEU FALL2025\MLops IE7374 Project\MLOps_Final\datasets\EXTRACTED_FILINGS\10-K\1652044_10K_2016_0001652044-17-000008.json,extract_and_convert
0001652044,Alphabet Inc.,2016,0001652044_10-K_2016,0001652044_10-K_2016_section_1_41,Business,item_1,0,10-K,41,Fueling all of these great digital experiences are powerful platforms and hardware.,7370,2017-02-03,bin_2016_2020,2025-10-25 00:42:34.754116,2025-10-25 00:42:34.754116,v2.1_combined_extraction,D:\JoelDesktop folds_24\NEU FALL2025\MLops IE7374 Project\MLOps_Final\datasets\EXTRACTED_FILINGS\10-K\1652044_10K_2016_0001652044-17-000008.json,extract_and_convert
0001652044,Alphabet Inc.,2016,0001652044_10-K_2016,0001652044_10-K_2016_section_1_42,Business,item_1,0,10-K,42,"That's why we continue to invest in platforms like our Chrome browser, Android mobile operating system, Chrome operating system, and Daydream virtual reality platform, as well as a new family of great hardware devices like the Pixel phone and Google Home.",7370,2017-02-03,bin_2016_2020,2025-10-25 00:42:34.754116,2025-10-25 00:42:34.754116,v2.1_combined_extraction,D:\JoelDesktop folds_24\NEU FALL2025\MLops IE7374 Project\MLOps_Final\datasets\EXTRACTED_FILINGS\10-K\1652044_10K_2016_0001652044-17-000008.json,extract_and_convert
0001652044,Alphabet Inc.,2016,0001652044_10-K_2016,0001652044_10-K_2016_section_1_43,Business,item_1,0,10-K,43,"Google was a company built in the cloud and has been investing in infrastructure, data management, analytics, and AI from the very beginning.",7370,2017-02-03,bin_2016_2020,2025-10-25 00:42:34.754116,2025-10-25 00:42:34.754116,v2.1_combined_extraction,D:\JoelDesktop folds_24\NEU FALL2025\MLops IE7374 Project\MLOps_Final\datasets\EXTRACTED_FILINGS\10-K\1652044_10K_2016_0001652044-17-000008.json,extract_and_convert
0001652044,Alphabet Inc.,2016,0001652044_10-K_2016,0001652044_10-K_2016_section_1_44,Business,item_1,0,10-K,44,We've taken those long-term investments and offer many of the same cloud services to our enterprise customers.,7370,2017-02-03,bin_2016_2020,2025-10-25 00:42:34.754116,2025-10-25 00:42:34.754116,v2.1_combined_extraction,D:\JoelDesktop folds_24\NEU FALL2025\MLops IE7374 Project\MLOps_Final\datasets\EXTRACTED_FILINGS\10-K\1652044_10K_2016_0001652044-17-000008.json,extract_and_convert
0001652044,Alphabet Inc.,2016,0001652044_10-K_2016,0001652044_10-K_2016_section_1_45,Business,item_1,0,10-K,45,"Because more and more of today's great digital experiences are being built in the cloud, our enterprise cloud products help businesses of all sizes take advantage of the latest technology advances to operate more efficiently.",7370,2017-02-03,bin_2016_2020,2025-10-25 00:42:34.754116,2025-10-25 00:42:34.754116,v2.1_combined_extraction,D:\JoelDesktop folds_24\NEU FALL2025\MLops IE7374 Project\MLOps_Final\datasets\EXTRACTED_FILINGS\10-K\1652044_10K_2016_0001652044-17-000008.json,extract_and_convert
0001652044,Alphabet Inc.,2016,0001652044_10-K_2016,0001652044_10-K_2016_section_1_46,Business,item_1,0,10-K,46,"How we make money The goal of our advertising business is to deliver relevant ads at just the right time and to give people useful commercial information, regardless of the device they're using.",7370,2017-02-03,bin_2016_2020,2025-10-25 00:42:34.754116,2025-10-25 00:42:34.754116,v2.1_combined_extraction,D:\JoelDesktop folds_24\NEU FALL2025\MLops IE7374 Project\MLOps_Final\datasets\EXTRACTED_FILINGS\10-K\1652044_10K_2016_0001652044-17-000008.json,extract_and_convert
0001652044,Alphabet Inc.,2016,0001652044_10-K_2016,0001652044_10-K_2016_section_1_47,Business,item_1,0,10-K,47,We also provide advertisers with tools that help them better attribute and measure their advertising campaigns across screens.,7370,2017-02-03,bin_2016_2020,2025-10-25 00:42:34.754116,2025-10-25 00:42:34.754116,v2.1_combined_extraction,D:\JoelDesktop folds_24\NEU FALL2025\MLops IE7374 Project\MLOps_Final\datasets\EXTRACTED_FILINGS\10-K\1652044_10K_2016_0001652044-17-000008.json,extract_and_convert
