cik,name,report_year,docID,sentenceID,section_name,section_item,section_ID,form,sentence_index,sentence,SIC,reportDate,temporal_bin,sample_created_at,last_modified_date,sample_version,source_file_path,load_method
0001652044,Alphabet Inc.,2016,0001652044_10-K_2016,0001652044_10-K_2016_section_1A_262,Risk Factors,item_1A,1,10-K,262,"In particular, Larry Page and Sergey Brin are critical to the overall management of Alphabet and its subsidiaries, and they, along with Sundar Pichai, the Chief Executive Officer of Google, play an important role in the development of our technology.",7370,2017-02-03,bin_2016_2020,2025-10-25 00:42:34.754116,2025-10-25 00:42:34.754116,v2.1_combined_extraction,D:\JoelDesktop folds_24\NEU FALL2025\MLops IE7374 Project\MLOps_Final\datasets\EXTRACTED_FILINGS\10-K\1652044_10K_2016_0001652044-17-000008.json,extract_and_convert
0001652044,Alphabet Inc.,2016,0001652044_10-K_2016,0001652044_10-K_2016_section_1A_263,Risk Factors,item_1A,1,10-K,263,"Along with our Executive Chairman Eric E. Schmidt, they also play a key role in maintaining our culture and setting our strategic direction.",7370,2017-02-03,bin_2016_2020,2025-10-25 00:42:34.754116,2025-10-25 00:42:34.754116,v2.1_combined_extraction,D:\JoelDesktop folds_24\NEU FALL2025\MLops IE7374 Project\MLOps_Final\datasets\EXTRACTED_FILINGS\10-K\1652044_10K_2016_0001652044-17-000008.json,extract_and_convert
0001652044,Alphabet Inc.,2016,0001652044_10-K_2016,0001652044_10-K_2016_section_1A_264,Risk Factors,item_1A,1,10-K,264,"All of our executive officers and key employees are at-will employees, and we do not maintain any key-person life insurance policies.",7370,2017-02-03,bin_2016_2020,2025-10-25 00:42:34.754116,2025-10-25 00:42:34.754116,v2.1_combined_extraction,D:\JoelDesktop folds_24\NEU FALL2025\MLops IE7374 Project\MLOps_Final\datasets\EXTRACTED_FILINGS\10-K\1652044_10K_2016_0001652044-17-000008.json,extract_and_convert
0001652044,Alphabet Inc.,2016,0001652044_10-K_2016,0001652044_10-K_2016_section_1A_265,Risk Factors,item_1A,1,10-K,265,The loss of key personnel could seriously harm our business.,7370,2017-02-03,bin_2016_2020,2025-10-25 00:42:34.754116,2025-10-25 00:42:34.754116,v2.1_combined_extraction,D:\JoelDesktop folds_24\NEU FALL2025\MLops IE7374 Project\MLOps_Final\datasets\EXTRACTED_FILINGS\10-K\1652044_10K_2016_0001652044-17-000008.json,extract_and_convert
0001652044,Alphabet Inc.,2016,0001652044_10-K_2016,0001652044_10-K_2016_section_1A_266,Risk Factors,item_1A,1,10-K,266,"We rely on highly skilled personnel and, if we are unable to retain or motivate key personnel, hire qualified personnel, or maintain our corporate culture, we may not be able to grow effectively.",7370,2017-02-03,bin_2016_2020,2025-10-25 00:42:34.754116,2025-10-25 00:42:34.754116,v2.1_combined_extraction,D:\JoelDesktop folds_24\NEU FALL2025\MLops IE7374 Project\MLOps_Final\datasets\EXTRACTED_FILINGS\10-K\1652044_10K_2016_0001652044-17-000008.json,extract_and_convert
0001652044,Alphabet Inc.,2016,0001652044_10-K_2016,0001652044_10-K_2016_section_1A_267,Risk Factors,item_1A,1,10-K,267,Our performance largely depends on the talents and efforts of highly skilled individuals.,7370,2017-02-03,bin_2016_2020,2025-10-25 00:42:34.754116,2025-10-25 00:42:34.754116,v2.1_combined_extraction,D:\JoelDesktop folds_24\NEU FALL2025\MLops IE7374 Project\MLOps_Final\datasets\EXTRACTED_FILINGS\10-K\1652044_10K_2016_0001652044-17-000008.json,extract_and_convert
0001652044,Alphabet Inc.,2016,0001652044_10-K_2016,0001652044_10-K_2016_section_1A_268,Risk Factors,item_1A,1,10-K,268,"Our future success depends on our continuing ability to identify, hire, develop, motivate, and retain highly skilled personnel for all areas of our organization.",7370,2017-02-03,bin_2016_2020,2025-10-25 00:42:34.754116,2025-10-25 00:42:34.754116,v2.1_combined_extraction,D:\JoelDesktop folds_24\NEU FALL2025\MLops IE7374 Project\MLOps_Final\datasets\EXTRACTED_FILINGS\10-K\1652044_10K_2016_0001652044-17-000008.json,extract_and_convert
0001652044,Alphabet Inc.,2016,0001652044_10-K_2016,0001652044_10-K_2016_section_1A_269,Risk Factors,item_1A,1,10-K,269,"Competition in our industry for qualified employees is intense, and certain of our competitors have directly targeted our employees.",7370,2017-02-03,bin_2016_2020,2025-10-25 00:42:34.754116,2025-10-25 00:42:34.754116,v2.1_combined_extraction,D:\JoelDesktop folds_24\NEU FALL2025\MLops IE7374 Project\MLOps_Final\datasets\EXTRACTED_FILINGS\10-K\1652044_10K_2016_0001652044-17-000008.json,extract_and_convert
0001652044,Alphabet Inc.,2016,0001652044_10-K_2016,0001652044_10-K_2016_section_1A_270,Risk Factors,item_1A,1,10-K,270,"In addition, our compensation arrangements, such as our equity award programs, may not always be successful in attracting new employees and retaining and motivating our existing employees.",7370,2017-02-03,bin_2016_2020,2025-10-25 00:42:34.754116,2025-10-25 00:42:34.754116,v2.1_combined_extraction,D:\JoelDesktop folds_24\NEU FALL2025\MLops IE7374 Project\MLOps_Final\datasets\EXTRACTED_FILINGS\10-K\1652044_10K_2016_0001652044-17-000008.json,extract_and_convert
0001652044,Alphabet Inc.,2016,0001652044_10-K_2016,0001652044_10-K_2016_section_1A_271,Risk Factors,item_1A,1,10-K,271,Our continued ability to compete effectively depends on our ability to attract new employees and to retain and motivate our existing employees.,7370,2017-02-03,bin_2016_2020,2025-10-25 00:42:34.754116,2025-10-25 00:42:34.754116,v2.1_combined_extraction,D:\JoelDesktop folds_24\NEU FALL2025\MLops IE7374 Project\MLOps_Final\datasets\EXTRACTED_FILINGS\10-K\1652044_10K_2016_0001652044-17-000008.json,extract_and_convert
0001652044,Alphabet Inc.,2016,0001652044_10-K_2016,0001652044_10-K_2016_section_1A_272,Risk Factors,item_1A,1,10-K,272,"In addition, we believe that our corporate culture fosters innovation, creativity, and teamwork.",7370,2017-02-03,bin_2016_2020,2025-10-25 00:42:34.754116,2025-10-25 00:42:34.754116,v2.1_combined_extraction,D:\JoelDesktop folds_24\NEU FALL2025\MLops IE7374 Project\MLOps_Final\datasets\EXTRACTED_FILINGS\10-K\1652044_10K_2016_0001652044-17-000008.json,extract_and_convert
0001652044,Alphabet Inc.,2016,0001652044_10-K_2016,0001652044_10-K_2016_section_1A_273,Risk Factors,item_1A,1,10-K,273,"As our organization grows, and we are required to implement more complex organizational management structures, particularly in light of our holding company structure, we may find it increasingly difficult to maintain the beneficial aspects of our corporate culture.",7370,2017-02-03,bin_2016_2020,2025-10-25 00:42:34.754116,2025-10-25 00:42:34.754116,v2.1_combined_extraction,D:\JoelDesktop folds_24\NEU FALL2025\MLops IE7374 Project\MLOps_Final\datasets\EXTRACTED_FILINGS\10-K\1652044_10K_2016_0001652044-17-000008.json,extract_and_convert
0001652044,Alphabet Inc.,2016,0001652044_10-K_2016,0001652044_10-K_2016_section_1A_274,Risk Factors,item_1A,1,10-K,274,This could negatively impact our future success.,7370,2017-02-03,bin_2016_2020,2025-10-25 00:42:34.754116,2025-10-25 00:42:34.754116,v2.1_combined_extraction,D:\JoelDesktop folds_24\NEU FALL2025\MLops IE7374 Project\MLOps_Final\datasets\EXTRACTED_FILINGS\10-K\1652044_10K_2016_0001652044-17-000008.json,extract_and_convert
0001652044,Alphabet Inc.,2016,0001652044_10-K_2016,0001652044_10-K_2016_section_1A_275,Risk Factors,item_1A,1,10-K,275,Alphabet Inc.,7370,2017-02-03,bin_2016_2020,2025-10-25 00:42:34.754116,2025-10-25 00:42:34.754116,v2.1_combined_extraction,D:\JoelDesktop folds_24\NEU FALL2025\MLops IE7374 Project\MLOps_Final\datasets\EXTRACTED_FILINGS\10-K\1652044_10K_2016_0001652044-17-000008.json,extract_and_convert
0001652044,Alphabet Inc.,2016,0001652044_10-K_2016,0001652044_10-K_2016_section_1A_276,Risk Factors,item_1A,1,10-K,276,Our business depends on continued and unimpeded access to the Internet by us and our users.,7370,2017-02-03,bin_2016_2020,2025-10-25 00:42:34.754116,2025-10-25 00:42:34.754116,v2.1_combined_extraction,D:\JoelDesktop folds_24\NEU FALL2025\MLops IE7374 Project\MLOps_Final\datasets\EXTRACTED_FILINGS\10-K\1652044_10K_2016_0001652044-17-000008.json,extract_and_convert
0001652044,Alphabet Inc.,2016,0001652044_10-K_2016,0001652044_10-K_2016_section_1A_277,Risk Factors,item_1A,1,10-K,277,"Internet access providers may be able to restrict, block, degrade, or charge for access to certain of our products and services, which could lead to additional expenses and the loss of users and advertisers.",7370,2017-02-03,bin_2016_2020,2025-10-25 00:42:34.754116,2025-10-25 00:42:34.754116,v2.1_combined_extraction,D:\JoelDesktop folds_24\NEU FALL2025\MLops IE7374 Project\MLOps_Final\datasets\EXTRACTED_FILINGS\10-K\1652044_10K_2016_0001652044-17-000008.json,extract_and_convert
0001652044,Alphabet Inc.,2016,0001652044_10-K_2016,0001652044_10-K_2016_section_1A_278,Risk Factors,item_1A,1,10-K,278,"Our products and services depend on the ability of our users to access the Internet, and certain of our products require significant bandwidth to work effectively.",7370,2017-02-03,bin_2016_2020,2025-10-25 00:42:34.754116,2025-10-25 00:42:34.754116,v2.1_combined_extraction,D:\JoelDesktop folds_24\NEU FALL2025\MLops IE7374 Project\MLOps_Final\datasets\EXTRACTED_FILINGS\10-K\1652044_10K_2016_0001652044-17-000008.json,extract_and_convert
0001652044,Alphabet Inc.,2016,0001652044_10-K_2016,0001652044_10-K_2016_section_1A_279,Risk Factors,item_1A,1,10-K,279,"Currently, this access is provided by companies that have significant market power in the broadband and internet access marketplace, including incumbent telephone companies, cable companies, mobile communications companies, and government-owned service providers.",7370,2017-02-03,bin_2016_2020,2025-10-25 00:42:34.754116,2025-10-25 00:42:34.754116,v2.1_combined_extraction,D:\JoelDesktop folds_24\NEU FALL2025\MLops IE7374 Project\MLOps_Final\datasets\EXTRACTED_FILINGS\10-K\1652044_10K_2016_0001652044-17-000008.json,extract_and_convert
0001652044,Alphabet Inc.,2016,0001652044_10-K_2016,0001652044_10-K_2016_section_1A_280,Risk Factors,item_1A,1,10-K,280,"Some of these providers have taken, or have stated that they may take measures, including legal actions, that could degrade, disrupt, or increase the cost of user access to certain of our products by restricting or prohibiting the use of their infrastructure to support or facilitate our offerings, or by charging increased fees to us or our users to provide our offerings.",7370,2017-02-03,bin_2016_2020,2025-10-25 00:42:34.754116,2025-10-25 00:42:34.754116,v2.1_combined_extraction,D:\JoelDesktop folds_24\NEU FALL2025\MLops IE7374 Project\MLOps_Final\datasets\EXTRACTED_FILINGS\10-K\1652044_10K_2016_0001652044-17-000008.json,extract_and_convert
0001652044,Alphabet Inc.,2016,0001652044_10-K_2016,0001652044_10-K_2016_section_1A_281,Risk Factors,item_1A,1,10-K,281,"In addition, in some jurisdictions, our products and services have been subject to government-initiated restrictions or blockages.",7370,2017-02-03,bin_2016_2020,2025-10-25 00:42:34.754116,2025-10-25 00:42:34.754116,v2.1_combined_extraction,D:\JoelDesktop folds_24\NEU FALL2025\MLops IE7374 Project\MLOps_Final\datasets\EXTRACTED_FILINGS\10-K\1652044_10K_2016_0001652044-17-000008.json,extract_and_convert
0001652044,Alphabet Inc.,2016,0001652044_10-K_2016,0001652044_10-K_2016_section_1A_282,Risk Factors,item_1A,1,10-K,282,"Such interference could result in a loss of existing users and advertisers, and increased costs, and could impair our ability to attract new users and advertisers, thereby harming our revenues and growth.",7370,2017-02-03,bin_2016_2020,2025-10-25 00:42:34.754116,2025-10-25 00:42:34.754116,v2.1_combined_extraction,D:\JoelDesktop folds_24\NEU FALL2025\MLops IE7374 Project\MLOps_Final\datasets\EXTRACTED_FILINGS\10-K\1652044_10K_2016_0001652044-17-000008.json,extract_and_convert
0001652044,Alphabet Inc.,2016,0001652044_10-K_2016,0001652044_10-K_2016_section_1A_283,Risk Factors,item_1A,1,10-K,283,"New and existing technologies could block ads online, which would harm our business.",7370,2017-02-03,bin_2016_2020,2025-10-25 00:42:34.754116,2025-10-25 00:42:34.754116,v2.1_combined_extraction,D:\JoelDesktop folds_24\NEU FALL2025\MLops IE7374 Project\MLOps_Final\datasets\EXTRACTED_FILINGS\10-K\1652044_10K_2016_0001652044-17-000008.json,extract_and_convert
0001652044,Alphabet Inc.,2016,0001652044_10-K_2016,0001652044_10-K_2016_section_1A_284,Risk Factors,item_1A,1,10-K,284,Technologies have been developed that can block the display of ads online and that provide tools to users to opt out of seeing ads online.,7370,2017-02-03,bin_2016_2020,2025-10-25 00:42:34.754116,2025-10-25 00:42:34.754116,v2.1_combined_extraction,D:\JoelDesktop folds_24\NEU FALL2025\MLops IE7374 Project\MLOps_Final\datasets\EXTRACTED_FILINGS\10-K\1652044_10K_2016_0001652044-17-000008.json,extract_and_convert
0001652044,Alphabet Inc.,2016,0001652044_10-K_2016,0001652044_10-K_2016_section_1A_285,Risk Factors,item_1A,1,10-K,285,Most of our Google revenues are derived from fees paid to us in connection with the display of ads online.,7370,2017-02-03,bin_2016_2020,2025-10-25 00:42:34.754116,2025-10-25 00:42:34.754116,v2.1_combined_extraction,D:\JoelDesktop folds_24\NEU FALL2025\MLops IE7374 Project\MLOps_Final\datasets\EXTRACTED_FILINGS\10-K\1652044_10K_2016_0001652044-17-000008.json,extract_and_convert
0001652044,Alphabet Inc.,2016,0001652044_10-K_2016,0001652044_10-K_2016_section_1A_286,Risk Factors,item_1A,1,10-K,286,"As a result, such technologies and tools could adversely affect our operating results.",7370,2017-02-03,bin_2016_2020,2025-10-25 00:42:34.754116,2025-10-25 00:42:34.754116,v2.1_combined_extraction,D:\JoelDesktop folds_24\NEU FALL2025\MLops IE7374 Project\MLOps_Final\datasets\EXTRACTED_FILINGS\10-K\1652044_10K_2016_0001652044-17-000008.json,extract_and_convert
0001652044,Alphabet Inc.,2016,0001652044_10-K_2016,0001652044_10-K_2016_section_1A_287,Risk Factors,item_1A,1,10-K,287,We are exposed to fluctuations in the market values of our investments.,7370,2017-02-03,bin_2016_2020,2025-10-25 00:42:34.754116,2025-10-25 00:42:34.754116,v2.1_combined_extraction,D:\JoelDesktop folds_24\NEU FALL2025\MLops IE7374 Project\MLOps_Final\datasets\EXTRACTED_FILINGS\10-K\1652044_10K_2016_0001652044-17-000008.json,extract_and_convert
0001652044,Alphabet Inc.,2016,0001652044_10-K_2016,0001652044_10-K_2016_section_1A_288,Risk Factors,item_1A,1,10-K,288,"Given the global nature of our business, we have investments both domestically and internationally.",7370,2017-02-03,bin_2016_2020,2025-10-25 00:42:34.754116,2025-10-25 00:42:34.754116,v2.1_combined_extraction,D:\JoelDesktop folds_24\NEU FALL2025\MLops IE7374 Project\MLOps_Final\datasets\EXTRACTED_FILINGS\10-K\1652044_10K_2016_0001652044-17-000008.json,extract_and_convert
0001652044,Alphabet Inc.,2016,0001652044_10-K_2016,0001652044_10-K_2016_section_1A_289,Risk Factors,item_1A,1,10-K,289,"Credit ratings and market values of these investments can be negatively impacted by liquidity, credit deterioration or losses, financial results, foreign exchange rates, changes in interest rates, or other factors.",7370,2017-02-03,bin_2016_2020,2025-10-25 00:42:34.754116,2025-10-25 00:42:34.754116,v2.1_combined_extraction,D:\JoelDesktop folds_24\NEU FALL2025\MLops IE7374 Project\MLOps_Final\datasets\EXTRACTED_FILINGS\10-K\1652044_10K_2016_0001652044-17-000008.json,extract_and_convert
0001652044,Alphabet Inc.,2016,0001652044_10-K_2016,0001652044_10-K_2016_section_1A_290,Risk Factors,item_1A,1,10-K,290,"As a result, the value or liquidity of our cash equivalents and marketable securities could decline and result in a material impairment, which could materially adversely affect our financial condition and operating results.",7370,2017-02-03,bin_2016_2020,2025-10-25 00:42:34.754116,2025-10-25 00:42:34.754116,v2.1_combined_extraction,D:\JoelDesktop folds_24\NEU FALL2025\MLops IE7374 Project\MLOps_Final\datasets\EXTRACTED_FILINGS\10-K\1652044_10K_2016_0001652044-17-000008.json,extract_and_convert
0001652044,Alphabet Inc.,2016,0001652044_10-K_2016,0001652044_10-K_2016_section_1A_291,Risk Factors,item_1A,1,10-K,291,"We could be subject to changes in tax rates, the adoption of new U.S. or international tax legislation, or exposure to additional tax liabilities.",7370,2017-02-03,bin_2016_2020,2025-10-25 00:42:34.754116,2025-10-25 00:42:34.754116,v2.1_combined_extraction,D:\JoelDesktop folds_24\NEU FALL2025\MLops IE7374 Project\MLOps_Final\datasets\EXTRACTED_FILINGS\10-K\1652044_10K_2016_0001652044-17-000008.json,extract_and_convert
0001652044,Alphabet Inc.,2016,0001652044_10-K_2016,0001652044_10-K_2016_section_1A_292,Risk Factors,item_1A,1,10-K,292,"Our future income taxes could be adversely affected by earnings being lower than anticipated in jurisdictions that have lower statutory tax rates and higher than anticipated in jurisdictions that have higher statutory tax rates, the net gains and losses recognized by legal entities on certain hedges and related hedged intercompany and other transactions under our foreign exchange risk management program, changes in the valuation of our deferred tax assets or liabilities, or changes in tax laws, regulations, or accounting principles, as well as certain discrete items.",7370,2017-02-03,bin_2016_2020,2025-10-25 00:42:34.754116,2025-10-25 00:42:34.754116,v2.1_combined_extraction,D:\JoelDesktop folds_24\NEU FALL2025\MLops IE7374 Project\MLOps_Final\datasets\EXTRACTED_FILINGS\10-K\1652044_10K_2016_0001652044-17-000008.json,extract_and_convert
0001652044,Alphabet Inc.,2016,0001652044_10-K_2016,0001652044_10-K_2016_section_1A_293,Risk Factors,item_1A,1,10-K,293,"Due to shifting economic and political conditions, tax policies or rates in various jurisdictions may be subject to significant change.",7370,2017-02-03,bin_2016_2020,2025-10-25 00:42:34.754116,2025-10-25 00:42:34.754116,v2.1_combined_extraction,D:\JoelDesktop folds_24\NEU FALL2025\MLops IE7374 Project\MLOps_Final\datasets\EXTRACTED_FILINGS\10-K\1652044_10K_2016_0001652044-17-000008.json,extract_and_convert
0001652044,Alphabet Inc.,2016,0001652044_10-K_2016,0001652044_10-K_2016_section_1A_294,Risk Factors,item_1A,1,10-K,294,"In addition, we are subject to regular review and audit by both domestic and foreign tax authorities.",7370,2017-02-03,bin_2016_2020,2025-10-25 00:42:34.754116,2025-10-25 00:42:34.754116,v2.1_combined_extraction,D:\JoelDesktop folds_24\NEU FALL2025\MLops IE7374 Project\MLOps_Final\datasets\EXTRACTED_FILINGS\10-K\1652044_10K_2016_0001652044-17-000008.json,extract_and_convert
0001652044,Alphabet Inc.,2016,0001652044_10-K_2016,0001652044_10-K_2016_section_1A_295,Risk Factors,item_1A,1,10-K,295,"As a result, we have received, and may in the future receive, assessments in multiple jurisdictions on various tax-related assertions, including transfer pricing adjustments or permanent establishment.",7370,2017-02-03,bin_2016_2020,2025-10-25 00:42:34.754116,2025-10-25 00:42:34.754116,v2.1_combined_extraction,D:\JoelDesktop folds_24\NEU FALL2025\MLops IE7374 Project\MLOps_Final\datasets\EXTRACTED_FILINGS\10-K\1652044_10K_2016_0001652044-17-000008.json,extract_and_convert
0001652044,Alphabet Inc.,2016,0001652044_10-K_2016,0001652044_10-K_2016_section_1A_296,Risk Factors,item_1A,1,10-K,296,Any adverse outcome of such a review or audit could have a negative effect on our operating results and financial condition.,7370,2017-02-03,bin_2016_2020,2025-10-25 00:42:34.754116,2025-10-25 00:42:34.754116,v2.1_combined_extraction,D:\JoelDesktop folds_24\NEU FALL2025\MLops IE7374 Project\MLOps_Final\datasets\EXTRACTED_FILINGS\10-K\1652044_10K_2016_0001652044-17-000008.json,extract_and_convert
0001652044,Alphabet Inc.,2016,0001652044_10-K_2016,0001652044_10-K_2016_section_1A_297,Risk Factors,item_1A,1,10-K,297,"In addition, the determination of our worldwide provision for income taxes and other tax liabilities requires significant judgment, and there are many transactions and calculations where the ultimate tax determination is uncertain.",7370,2017-02-03,bin_2016_2020,2025-10-25 00:42:34.754116,2025-10-25 00:42:34.754116,v2.1_combined_extraction,D:\JoelDesktop folds_24\NEU FALL2025\MLops IE7374 Project\MLOps_Final\datasets\EXTRACTED_FILINGS\10-K\1652044_10K_2016_0001652044-17-000008.json,extract_and_convert
0001652044,Alphabet Inc.,2016,0001652044_10-K_2016,0001652044_10-K_2016_section_1A_298,Risk Factors,item_1A,1,10-K,298,"Although we believe our estimates are reasonable, the ultimate tax outcome may differ from the amounts recorded in our financial statements and may materially affect our financial results in the period or periods for which such determination is made.",7370,2017-02-03,bin_2016_2020,2025-10-25 00:42:34.754116,2025-10-25 00:42:34.754116,v2.1_combined_extraction,D:\JoelDesktop folds_24\NEU FALL2025\MLops IE7374 Project\MLOps_Final\datasets\EXTRACTED_FILINGS\10-K\1652044_10K_2016_0001652044-17-000008.json,extract_and_convert
0001652044,Alphabet Inc.,2016,0001652044_10-K_2016,0001652044_10-K_2016_section_1A_299,Risk Factors,item_1A,1,10-K,299,Risks Related to Ownership of Our Stock The trading price for our Class A common stock and non-voting Class C capital stock may continue to be volatile.,7370,2017-02-03,bin_2016_2020,2025-10-25 00:42:34.754116,2025-10-25 00:42:34.754116,v2.1_combined_extraction,D:\JoelDesktop folds_24\NEU FALL2025\MLops IE7374 Project\MLOps_Final\datasets\EXTRACTED_FILINGS\10-K\1652044_10K_2016_0001652044-17-000008.json,extract_and_convert
0001652044,Alphabet Inc.,2016,0001652044_10-K_2016,0001652044_10-K_2016_section_1A_300,Risk Factors,item_1A,1,10-K,300,The trading price of our stock has at times experienced substantial price volatility and may continue to be volatile.,7370,2017-02-03,bin_2016_2020,2025-10-25 00:42:34.754116,2025-10-25 00:42:34.754116,v2.1_combined_extraction,D:\JoelDesktop folds_24\NEU FALL2025\MLops IE7374 Project\MLOps_Final\datasets\EXTRACTED_FILINGS\10-K\1652044_10K_2016_0001652044-17-000008.json,extract_and_convert
0001652044,Alphabet Inc.,2016,0001652044_10-K_2016,0001652044_10-K_2016_section_1A_301,Risk Factors,item_1A,1,10-K,301,"For example, from January 1, 2016 through December 31, 2016, the closing price of our Class A common stock ranged from $681.14 per share to $835.74 per share, and the closing price of our Class C capital stock ranged from $668.26 to $813.11 per share.",7370,2017-02-03,bin_2016_2020,2025-10-25 00:42:34.754116,2025-10-25 00:42:34.754116,v2.1_combined_extraction,D:\JoelDesktop folds_24\NEU FALL2025\MLops IE7374 Project\MLOps_Final\datasets\EXTRACTED_FILINGS\10-K\1652044_10K_2016_0001652044-17-000008.json,extract_and_convert
0001652044,Alphabet Inc.,2016,0001652044_10-K_2016,0001652044_10-K_2016_section_1A_302,Risk Factors,item_1A,1,10-K,302,"In addition to the factors discussed in this Annual Report on Form 10-K, the trading price of our Class A common stock and Class C capital stock may fluctuate widely in response to various factors, many of which are beyond our control, including, among others:",7370,2017-02-03,bin_2016_2020,2025-10-25 00:42:34.754116,2025-10-25 00:42:34.754116,v2.1_combined_extraction,D:\JoelDesktop folds_24\NEU FALL2025\MLops IE7374 Project\MLOps_Final\datasets\EXTRACTED_FILINGS\10-K\1652044_10K_2016_0001652044-17-000008.json,extract_and_convert
0001652044,Alphabet Inc.,2016,0001652044_10-K_2016,0001652044_10-K_2016_section_1A_303,Risk Factors,item_1A,1,10-K,303,• Quarterly variations in our results of operations or those of our competitors.,7370,2017-02-03,bin_2016_2020,2025-10-25 00:42:34.754116,2025-10-25 00:42:34.754116,v2.1_combined_extraction,D:\JoelDesktop folds_24\NEU FALL2025\MLops IE7374 Project\MLOps_Final\datasets\EXTRACTED_FILINGS\10-K\1652044_10K_2016_0001652044-17-000008.json,extract_and_convert
0001652044,Alphabet Inc.,2016,0001652044_10-K_2016,0001652044_10-K_2016_section_1A_304,Risk Factors,item_1A,1,10-K,304,"• Announcements by us or our competitors of acquisitions, divestitures, investments, new products, significant contracts, commercial relationships, or capital commitments.",7370,2017-02-03,bin_2016_2020,2025-10-25 00:42:34.754116,2025-10-25 00:42:34.754116,v2.1_combined_extraction,D:\JoelDesktop folds_24\NEU FALL2025\MLops IE7374 Project\MLOps_Final\datasets\EXTRACTED_FILINGS\10-K\1652044_10K_2016_0001652044-17-000008.json,extract_and_convert
0001652044,Alphabet Inc.,2016,0001652044_10-K_2016,0001652044_10-K_2016_section_1A_305,Risk Factors,item_1A,1,10-K,305,• Recommendations by securities analysts or changes in earnings estimates.,7370,2017-02-03,bin_2016_2020,2025-10-25 00:42:34.754116,2025-10-25 00:42:34.754116,v2.1_combined_extraction,D:\JoelDesktop folds_24\NEU FALL2025\MLops IE7374 Project\MLOps_Final\datasets\EXTRACTED_FILINGS\10-K\1652044_10K_2016_0001652044-17-000008.json,extract_and_convert
0001652044,Alphabet Inc.,2016,0001652044_10-K_2016,0001652044_10-K_2016_section_1A_306,Risk Factors,item_1A,1,10-K,306,Alphabet Inc.,7370,2017-02-03,bin_2016_2020,2025-10-25 00:42:34.754116,2025-10-25 00:42:34.754116,v2.1_combined_extraction,D:\JoelDesktop folds_24\NEU FALL2025\MLops IE7374 Project\MLOps_Final\datasets\EXTRACTED_FILINGS\10-K\1652044_10K_2016_0001652044-17-000008.json,extract_and_convert
0001652044,Alphabet Inc.,2016,0001652044_10-K_2016,0001652044_10-K_2016_section_1A_307,Risk Factors,item_1A,1,10-K,307,"• Announcements about our earnings that are not in line with analyst expectations, the risk of which is enhanced because it is our policy not to give guidance on earnings.",7370,2017-02-03,bin_2016_2020,2025-10-25 00:42:34.754116,2025-10-25 00:42:34.754116,v2.1_combined_extraction,D:\JoelDesktop folds_24\NEU FALL2025\MLops IE7374 Project\MLOps_Final\datasets\EXTRACTED_FILINGS\10-K\1652044_10K_2016_0001652044-17-000008.json,extract_and_convert
